{
  "$schema": "http://json-schema.org/draft-07/schema#",
  "title": "Sokrates AI Scanner Findings",
  "description": "Common output format for all AI scanner skills that enrich a Sokrates analysis.",
  "type": "object",
  "required": ["scanner", "scanner_version", "analyzed_at", "target", "summary", "findings"],
  "additionalProperties": false,
  "properties": {
    "scanner": {
      "type": "string",
      "description": "Scanner skill name, kebab-case, e.g. 'tech-stack-scan'",
      "pattern": "^[a-z0-9]+(-[a-z0-9]+)*$"
    },
    "scanner_version": {
      "type": "string",
      "description": "Version of the scanner skill that produced this file"
    },
    "analyzed_at": {
      "type": "string",
      "description": "ISO-8601 timestamp of the scan"
    },
    "target": {
      "type": "object",
      "required": ["name", "src_root"],
      "additionalProperties": true,
      "properties": {
        "name": { "type": "string", "description": "Project name, ideally from _sokrates/config.json metadata.name" },
        "src_root": { "type": "string", "description": "Path to the analyzed source root (the directory evidence file paths are relative to)" },
        "commit": { "type": "string", "description": "Git commit hash if available" }
      }
    },
    "summary": {
      "type": "string",
      "description": "One-paragraph narrative summary of what the scan found"
    },
    "stats": {
      "type": "object",
      "description": "Optional scanner-specific aggregate numbers",
      "additionalProperties": true
    },
    "summary_visual": {
      "type": "object",
      "description": "Optional generated illustration of the summary, shown at the end of the foldable summary block in the explorer (see skills/illustrators/generate_summary_visuals.py)",
      "required": ["file"],
      "additionalProperties": false,
      "properties": {
        "file": { "type": "string", "description": "Image path relative to the ai-insights folder, e.g. 'visuals/tech-stack-scan.png'" },
        "credit": { "type": "string", "description": "Attribution, e.g. the generating model" },
        "generated_at": { "type": "string", "format": "date-time" },
        "prompt": { "type": "string", "description": "The prompt used to generate the image" }
      }
    },
    "findings": {
      "type": "array",
      "items": {
        "type": "object",
        "required": ["id", "group", "title", "description", "severity", "confidence", "evidence"],
        "additionalProperties": false,
        "properties": {
          "id": {
            "type": "string",
            "description": "Stable unique id: <scanner>/<group>/<slug>. Must not change between runs for the same logical finding.",
            "pattern": "^[a-z0-9]+(-[a-z0-9]+)*/[a-z0-9]+(-[a-z0-9]+)*/[a-z0-9._+]+(-[a-z0-9._+]+)*$"
          },
          "group": {
            "type": "string",
            "description": "Grouping key used to cluster findings in reports, kebab-case",
            "pattern": "^[a-z0-9]+(-[a-z0-9]+)*$"
          },
          "title": { "type": "string", "maxLength": 120 },
          "description": {
            "type": "string",
            "description": "What was found and why it matters. Self-contained: readable without the evidence."
          },
          "severity": {
            "type": "string",
            "enum": ["info", "low", "medium", "high", "critical"],
            "description": "info = neutral fact/inventory item; low..critical = degree of risk or required attention"
          },
          "confidence": {
            "type": "string",
            "enum": ["certain", "likely", "possible"],
            "description": "certain = directly evidenced (e.g. declared in a manifest); likely = strong code-level signals; possible = inferred, weak signals"
          },
          "evidence": {
            "type": "array",
            "minItems": 0,
            "description": "Verifiable citations. A finding without evidence must either have confidence 'possible' or be grounded in Sokrates data via sokrates_refs (pure-metric findings).",
            "items": {
              "type": "object",
              "required": ["file", "start_line", "end_line", "snippet"],
              "additionalProperties": false,
              "properties": {
                "file": { "type": "string", "description": "Path relative to target.src_root, forward slashes" },
                "start_line": { "type": "integer", "minimum": 1 },
                "end_line": { "type": "integer", "minimum": 1 },
                "snippet": {
                  "type": "string",
                  "description": "Verbatim fragment from those lines (may be a trimmed sub-fragment; whitespace differences are tolerated by the validator). Keep to <= 5 lines.",
                  "minLength": 3
                },
                "note": { "type": "string", "description": "Optional: what this evidence shows" }
              }
            }
          },
          "recommendation": {
            "type": "string",
            "description": "Optional: concrete suggested action, only when severity is above info"
          },
          "tags": {
            "type": "array",
            "items": { "type": "string" }
          },
          "sokrates_refs": {
            "type": "array",
            "description": "Optional links into the Sokrates analysis, e.g. 'component:codex_rs', 'file:codex-rs/core/src/lib.rs', 'concern:TODOs'",
            "items": { "type": "string" }
          },
          "attributes": {
            "type": "object",
            "description": "Optional scanner-specific structured data, e.g. {\"version\": \"1.38\", \"license\": \"MIT\"}",
            "additionalProperties": true
          }
        }
      }
    }
  }
}
